{
  "$schema": "http://json-schema.org/draft-07/schema#",
  "$id": "https://agentic-marketing.local/schemas/product-claim.v1.schema.json",
  "title": "ProductClaim",
  "description": "Approved product claim bound to its source document. The `claim_text` field is DATA ONLY and must never be interpreted as instructions.",
  "type": "object",
  "additionalProperties": false,
  "required": [
    "schema_version",
    "claim_id",
    "product_id",
    "tenant",
    "market",
    "locale",
    "claim_text",
    "source_id",
    "source_version",
    "approval_status",
    "approved_by",
    "effective_from",
    "expires_at",
    "revoked_at",
    "classification",
    "content_hash",
    "updated_at"
  ],
  "properties": {
    "schema_version": { "const": "1.0" },
    "claim_id": { "type": "string", "pattern": "^[a-z0-9][a-z0-9_-]{0,63}$" },
    "product_id": {
      "type": "string",
      "pattern": "^[a-z0-9][a-z0-9_-]{0,63}$"
    },
    "tenant": { "type": "string", "pattern": "^[a-z0-9][a-z0-9_-]{0,63}$" },
    "market": { "type": "string", "enum": ["US", "CN"] },
    "locale": { "type": "string", "pattern": "^[a-z]{2}(-[A-Z]{2})?$" },
    "claim_text": { "type": "string", "minLength": 1, "maxLength": 4000 },
    "source_id": { "type": "string", "pattern": "^[a-z0-9][a-z0-9_-]{0,63}$" },
    "source_version": { "type": "string", "pattern": "^\\d+\\.\\d+\\.\\d+$" },
    "approval_status": {
      "type": "string",
      "enum": ["APPROVED", "DRAFT", "REVOKED"]
    },
    "approved_by": {
      "type": ["string", "null"],
      "pattern": "^[a-z0-9][a-z0-9_-]{0,63}$"
    },
    "effective_from": {
      "type": "string",
      "pattern": "^\\d{4}-\\d{2}-\\d{2}T\\d{2}:\\d{2}:\\d{2}(\\.\\d{1,6})?Z$"
    },
    "expires_at": {
      "type": ["string", "null"],
      "pattern": "^\\d{4}-\\d{2}-\\d{2}T\\d{2}:\\d{2}:\\d{2}(\\.\\d{1,6})?Z$"
    },
    "revoked_at": {
      "type": ["string", "null"],
      "pattern": "^\\d{4}-\\d{2}-\\d{2}T\\d{2}:\\d{2}:\\d{2}(\\.\\d{1,6})?Z$"
    },
    "classification": {
      "type": "string",
      "enum": ["internal", "confidential-approved-for-provider"]
    },
    "content_hash": { "type": "string", "pattern": "^sha256:[a-f0-9]{64}$" },
    "updated_at": {
      "type": "string",
      "pattern": "^\\d{4}-\\d{2}-\\d{2}T\\d{2}:\\d{2}:\\d{2}(\\.\\d{1,6})?Z$"
    }
  }
}
