[
  {
    "schema_version": "1.0",
    "claim_id": "claim-alpha-efficacy",
    "product_id": "product-alpha",
    "tenant": "tenant-cshi",
    "market": "US",
    "locale": "en-US",
    "claim_text": "Product Alpha reduced symptom score by 30% versus placebo in Study X.",
    "source_id": "doc-alpha-label",
    "source_version": "2.1.0",
    "approval_status": "APPROVED",
    "approved_by": "emp-1001",
    "effective_from": "2026-01-01T00:00:00Z",
    "expires_at": "2027-01-01T00:00:00Z",
    "revoked_at": null,
    "classification": "internal",
    "content_hash": "sha256:dddddddddddddddddddddddddddddddddddddddddddddddddddddddddddddddd",
    "updated_at": "2026-01-01T00:00:00Z"
  },
  {
    "schema_version": "1.0",
    "claim_id": "claim-alpha-expired",
    "product_id": "product-alpha",
    "tenant": "tenant-cshi",
    "market": "US",
    "locale": "en-US",
    "claim_text": "Legacy claim that expired with the 2025 label.",
    "source_id": "doc-alpha-expired",
    "source_version": "1.0.0",
    "approval_status": "APPROVED",
    "approved_by": "emp-1001",
    "effective_from": "2025-01-01T00:00:00Z",
    "expires_at": "2026-01-01T00:00:00Z",
    "revoked_at": null,
    "classification": "internal",
    "content_hash": "sha256:eeeeeeeeeeeeeeeeeeeeeeeeeeeeeeeeeeeeeeeeeeeeeeeeeeeeeeeeeeeeeeee",
    "updated_at": "2025-01-01T00:00:00Z"
  },
  {
    "schema_version": "1.0",
    "claim_id": "claim-alpha-revoked",
    "product_id": "product-alpha",
    "tenant": "tenant-cshi",
    "market": "US",
    "locale": "en-US",
    "claim_text": "Withdrawn superiority claim.",
    "source_id": "doc-alpha-revoked",
    "source_version": "1.1.0",
    "approval_status": "REVOKED",
    "approved_by": "emp-1001",
    "effective_from": "2025-06-01T00:00:00Z",
    "expires_at": null,
    "revoked_at": "2026-03-01T00:00:00Z",
    "classification": "internal",
    "content_hash": "sha256:ffffffffffffffffffffffffffffffffffffffffffffffffffffffffffffffff",
    "updated_at": "2026-03-01T00:00:00Z"
  },
  {
    "schema_version": "1.0",
    "claim_id": "claim-alpha-cn",
    "product_id": "product-alpha",
    "tenant": "tenant-cshi",
    "market": "CN",
    "locale": "zh-CN",
    "claim_text": "CN market approved claim for Product Alpha.",
    "source_id": "doc-alpha-cn",
    "source_version": "1.0.0",
    "approval_status": "APPROVED",
    "approved_by": "emp-1003",
    "effective_from": "2026-01-01T00:00:00Z",
    "expires_at": null,
    "revoked_at": null,
    "classification": "internal",
    "content_hash": "sha256:abababababababababababababababababababababababababababababababab",
    "updated_at": "2026-01-01T00:00:00Z"
  },
  {
    "schema_version": "1.0",
    "claim_id": "claim-other-tenant",
    "product_id": "product-alpha",
    "tenant": "tenant-other",
    "market": "US",
    "locale": "en-US",
    "claim_text": "Claim belonging to another tenant.",
    "source_id": "doc-other-tenant",
    "source_version": "1.0.0",
    "approval_status": "APPROVED",
    "approved_by": "emp-2001",
    "effective_from": "2026-01-01T00:00:00Z",
    "expires_at": null,
    "revoked_at": null,
    "classification": "confidential-approved-for-provider",
    "content_hash": "sha256:cdcdcdcdcdcdcdcdcdcdcdcdcdcdcdcdcdcdcdcdcdcdcdcdcdcdcdcdcdcdcdcd",
    "updated_at": "2026-01-01T00:00:00Z"
  }
]
